{
  "$schema": "../schemas/dependency-governance.schema.json",
  "schemaVersion": 1,
  "policy": {
    "$schema": "../schemas/dependency-policy.schema.json",
    "schemaVersion": 1,
    "failOnSeverity": "high",
    "deniedLicenses": [
      "AGPL-3.0",
      "AGPL-3.0-only",
      "AGPL-3.0-or-later",
      "GPL-2.0",
      "GPL-2.0-only",
      "GPL-2.0-or-later",
      "GPL-3.0",
      "GPL-3.0-only",
      "GPL-3.0-or-later"
    ],
    "commentSummaryInPr": "never",
    "auditExceptions": [],
    "licenseReviews": [],
    "distributedNodeRuntimeDependencies": false
  },
  "auditEvidence": {
    "schemaVersion": 1,
    "status": "passed",
    "reasonCode": null,
    "source": "npm-audit",
    "lockDigest": "sha256:4711e15cb56aef1bfa4d3e655a20fe5c4bc72f87ff22f3656705ed2145b01267",
    "scope": {
      "maintenanceDevOnly": true,
      "runtimeDistributed": false
    },
    "vulnerabilities": {
      "info": 0,
      "low": 0,
      "moderate": 0,
      "high": 0,
      "critical": 0,
      "total": 0
    },
    "findings": [],
    "exceptionsApplied": [],
    "policyViolations": []
  },
  "licenseEvidence": {
    "$schema": "../schemas/dependency-license-evidence.schema.json",
    "schemaVersion": 1,
    "status": "passed",
    "reasonCode": null,
    "lockDigest": "sha256:4711e15cb56aef1bfa4d3e655a20fe5c4bc72f87ff22f3656705ed2145b01267",
    "policyDigest": "sha256:42d400104ec7172da86281a912d4329403e9bac682e067b5e099fc7d939acb8c",
    "scope": {
      "root": true,
      "workspaces": true,
      "direct": true,
      "transitive": true,
      "development": true,
      "runtimeDistributed": false
    },
    "packages": [
      {
        "path": ".",
        "name": "llm-plugins-fusion-maintenance",
        "version": "4.1.0",
        "direct": true,
        "workspace": false,
        "development": true,
        "optional": false,
        "licenseExpression": "MIT",
        "ast": {
          "license": "MIT"
        },
        "status": "passed",
        "reasonCode": null
      },
      {
        "path": "node_modules/@types/node",
        "name": "@types/node",
        "version": "22.20.1",
        "direct": true,
        "workspace": false,
        "development": true,
        "optional": false,
        "licenseExpression": "MIT",
        "ast": {
          "license": "MIT"
        },
        "status": "passed",
        "reasonCode": null
      },
      {
        "path": "node_modules/@typescript/typescript-aix-ppc64",
        "name": "@typescript/typescript-aix-ppc64",
        "version": "7.0.2",
        "direct": false,
        "workspace": false,
        "development": true,
        "optional": true,
        "licenseExpression": "Apache-2.0",
        "ast": {
          "license": "Apache-2.0"
        },
        "status": "passed",
        "reasonCode": null
      },
      {
        "path": "node_modules/@typescript/typescript-darwin-arm64",
        "name": "@typescript/typescript-darwin-arm64",
        "version": "7.0.2",
        "direct": false,
        "workspace": false,
        "development": true,
        "optional": true,
        "licenseExpression": "Apache-2.0",
        "ast": {
          "license": "Apache-2.0"
        },
        "status": "passed",
        "reasonCode": null
      },
      {
        "path": "node_modules/@typescript/typescript-darwin-x64",
        "name": "@typescript/typescript-darwin-x64",
        "version": "7.0.2",
        "direct": false,
        "workspace": false,
        "development": true,
        "optional": true,
        "licenseExpression": "Apache-2.0",
        "ast": {
          "license": "Apache-2.0"
        },
        "status": "passed",
        "reasonCode": null
      },
      {
        "path": "node_modules/@typescript/typescript-freebsd-arm64",
        "name": "@typescript/typescript-freebsd-arm64",
        "version": "7.0.2",
        "direct": false,
        "workspace": false,
        "development": true,
        "optional": true,
        "licenseExpression": "Apache-2.0",
        "ast": {
          "license": "Apache-2.0"
        },
        "status": "passed",
        "reasonCode": null
      },
      {
        "path": "node_modules/@typescript/typescript-freebsd-x64",
        "name": "@typescript/typescript-freebsd-x64",
        "version": "7.0.2",
        "direct": false,
        "workspace": false,
        "development": true,
        "optional": true,
        "licenseExpression": "Apache-2.0",
        "ast": {
          "license": "Apache-2.0"
        },
        "status": "passed",
        "reasonCode": null
      },
      {
        "path": "node_modules/@typescript/typescript-linux-arm",
        "name": "@typescript/typescript-linux-arm",
        "version": "7.0.2",
        "direct": false,
        "workspace": false,
        "development": true,
        "optional": true,
        "licenseExpression": "Apache-2.0",
        "ast": {
          "license": "Apache-2.0"
        },
        "status": "passed",
        "reasonCode": null
      },
      {
        "path": "node_modules/@typescript/typescript-linux-arm64",
        "name": "@typescript/typescript-linux-arm64",
        "version": "7.0.2",
        "direct": false,
        "workspace": false,
        "development": true,
        "optional": true,
        "licenseExpression": "Apache-2.0",
        "ast": {
          "license": "Apache-2.0"
        },
        "status": "passed",
        "reasonCode": null
      },
      {
        "path": "node_modules/@typescript/typescript-linux-loong64",
        "name": "@typescript/typescript-linux-loong64",
        "version": "7.0.2",
        "direct": false,
        "workspace": false,
        "development": true,
        "optional": true,
        "licenseExpression": "Apache-2.0",
        "ast": {
          "license": "Apache-2.0"
        },
        "status": "passed",
        "reasonCode": null
      },
      {
        "path": "node_modules/@typescript/typescript-linux-mips64el",
        "name": "@typescript/typescript-linux-mips64el",
        "version": "7.0.2",
        "direct": false,
        "workspace": false,
        "development": true,
        "optional": true,
        "licenseExpression": "Apache-2.0",
        "ast": {
          "license": "Apache-2.0"
        },
        "status": "passed",
        "reasonCode": null
      },
      {
        "path": "node_modules/@typescript/typescript-linux-ppc64",
        "name": "@typescript/typescript-linux-ppc64",
        "version": "7.0.2",
        "direct": false,
        "workspace": false,
        "development": true,
        "optional": true,
        "licenseExpression": "Apache-2.0",
        "ast": {
          "license": "Apache-2.0"
        },
        "status": "passed",
        "reasonCode": null
      },
      {
        "path": "node_modules/@typescript/typescript-linux-riscv64",
        "name": "@typescript/typescript-linux-riscv64",
        "version": "7.0.2",
        "direct": false,
        "workspace": false,
        "development": true,
        "optional": true,
        "licenseExpression": "Apache-2.0",
        "ast": {
          "license": "Apache-2.0"
        },
        "status": "passed",
        "reasonCode": null
      },
      {
        "path": "node_modules/@typescript/typescript-linux-s390x",
        "name": "@typescript/typescript-linux-s390x",
        "version": "7.0.2",
        "direct": false,
        "workspace": false,
        "development": true,
        "optional": true,
        "licenseExpression": "Apache-2.0",
        "ast": {
          "license": "Apache-2.0"
        },
        "status": "passed",
        "reasonCode": null
      },
      {
        "path": "node_modules/@typescript/typescript-linux-x64",
        "name": "@typescript/typescript-linux-x64",
        "version": "7.0.2",
        "direct": false,
        "workspace": false,
        "development": true,
        "optional": true,
        "licenseExpression": "Apache-2.0",
        "ast": {
          "license": "Apache-2.0"
        },
        "status": "passed",
        "reasonCode": null
      },
      {
        "path": "node_modules/@typescript/typescript-netbsd-arm64",
        "name": "@typescript/typescript-netbsd-arm64",
        "version": "7.0.2",
        "direct": false,
        "workspace": false,
        "development": true,
        "optional": true,
        "licenseExpression": "Apache-2.0",
        "ast": {
          "license": "Apache-2.0"
        },
        "status": "passed",
        "reasonCode": null
      },
      {
        "path": "node_modules/@typescript/typescript-netbsd-x64",
        "name": "@typescript/typescript-netbsd-x64",
        "version": "7.0.2",
        "direct": false,
        "workspace": false,
        "development": true,
        "optional": true,
        "licenseExpression": "Apache-2.0",
        "ast": {
          "license": "Apache-2.0"
        },
        "status": "passed",
        "reasonCode": null
      },
      {
        "path": "node_modules/@typescript/typescript-openbsd-arm64",
        "name": "@typescript/typescript-openbsd-arm64",
        "version": "7.0.2",
        "direct": false,
        "workspace": false,
        "development": true,
        "optional": true,
        "licenseExpression": "Apache-2.0",
        "ast": {
          "license": "Apache-2.0"
        },
        "status": "passed",
        "reasonCode": null
      },
      {
        "path": "node_modules/@typescript/typescript-openbsd-x64",
        "name": "@typescript/typescript-openbsd-x64",
        "version": "7.0.2",
        "direct": false,
        "workspace": false,
        "development": true,
        "optional": true,
        "licenseExpression": "Apache-2.0",
        "ast": {
          "license": "Apache-2.0"
        },
        "status": "passed",
        "reasonCode": null
      },
      {
        "path": "node_modules/@typescript/typescript-sunos-x64",
        "name": "@typescript/typescript-sunos-x64",
        "version": "7.0.2",
        "direct": false,
        "workspace": false,